{
  "businessTimezone": "Asia/Shanghai",
  "datasetId": "charging_sample_7d_v2",
  "definitions": {
    "chargingUtilization": "CHARGING samples / all samples of complete hours; includes maintenance in denominator",
    "cohorts": "final outcomes in this batch grouped by creation/join date; not historical as-of status",
    "completedSessions": "charging ended; includes unpaid finished sessions",
    "dates": "Asia/Shanghai, start inclusive and end exclusive",
    "energy": "integer Wh",
    "mlFeatures": "known information from 24 complete hours before reference_time; no future weather or labels",
    "mlTargets": "separate future labels; NEVER import into serving/API database",
    "money": "integer CNY cents",
    "netPaid": "successful payment receipts minus refunds on transaction business date",
    "simulation": "business records and illustrative locations are simulated; weather provenance follows raw manifest",
    "snapshot": "latest state in batch, separate from date-filtered period metrics",
    "timestamps": "UTC ISO8601 Z; hourly records label interval START"
  },
  "endDate": "2025-12-08",
  "featureVersion": "history24-v1",
  "generatedAt": "2026-09-12T13:59:53.987019Z",
  "mlHistoryHours": 24,
  "mlSplits": {
    "end": "2025-12-07",
    "start": "2025-12-02",
    "trainEnd": "2025-12-05",
    "usable": true,
    "validationEnd": "2025-12-06"
  },
  "periodEndExclusive": "2025-12-07T16:00:00Z",
  "periodStart": "2025-11-30T16:00:00Z",
  "pipelineRunId": "spark-109d317486184d24bd58d8d8bb3c7c79",
  "publishedBatchId": "analytics-76be09e255f94277aa2613b4edc8d8f3",
  "qualityReportPath": "quality_report.json",
  "qualityReportSha256": "dcc9638f0dae2de308eff3868769d997a405595fce11a66748ae5485eac13ec3",
  "schemaVersion": "1.0.0",
  "source": "SIMULATED",
  "sourceManifestSha256": "fac612b1fca3289d7bae176ceb009dfac1e037176c1e42635fef7d96be8adf29",
  "startDate": "2025-12-01",
  "storageProfile": "PORTABLE_CSV_GZIP",
  "tables": {
    "cities": {
      "columns": [
        {
          "name": "city_id",
          "nullable": false,
          "type": "string"
        },
        {
          "name": "city_name",
          "nullable": true,
          "type": "string"
        },
        {
          "name": "latitude",
          "nullable": true,
          "type": "number"
        },
        {
          "name": "longitude",
          "nullable": true,
          "type": "number"
        },
        {
          "name": "timezone",
          "nullable": true,
          "type": "string"
        }
      ],
      "files": [
        {
          "bytes": 207,
          "path": "csv/cities/part-00000-da40290c-3e82-4af3-a6f5-c8575bf67c0a-c000.csv.gz",
          "sha256": "6d7863b2809c0288e71689492788e6f3eb1954ca0f83091d03cf0440a10d53a9"
        }
      ],
      "primaryKey": [
        "city_id"
      ],
      "rows": 5
    },
    "city_daily": {
      "columns": [
        {
          "name": "city_id",
          "nullable": false,
          "type": "string"
        },
        {
          "name": "business_date",
          "nullable": false,
          "type": "date"
        },
        {
          "name": "station_count",
          "nullable": false,
          "type": "integer"
        },
        {
          "name": "energy_wh",
          "nullable": true,
          "type": "integer",
          "unit": "Wh"
        },
        {
          "name": "grid_cost_cents",
          "nullable": true,
          "type": "integer",
          "unit": "CNY_cents"
        },
        {
          "name": "completed_sessions",
          "nullable": true,
          "type": "integer"
        },
        {
          "name": "paid_cents",
          "nullable": true,
          "type": "integer",
          "unit": "CNY_cents"
        },
        {
          "name": "refund_cents",
          "nullable": true,
          "type": "integer",
          "unit": "CNY_cents"
        },
        {
          "name": "operating_cost_cents",
          "nullable": true,
          "type": "integer",
          "unit": "CNY_cents"
        },
        {
          "name": "maintenance_cost_cents",
          "nullable": true,
          "type": "integer",
          "unit": "CNY_cents"
        },
        {
          "name": "net_paid_cents",
          "nullable": true,
          "type": "integer",
          "unit": "CNY_cents"
        },
        {
          "name": "started_sessions",
          "nullable": true,
          "type": "integer"
        },
        {
          "name": "available_samples",
          "nullable": true,
          "type": "integer"
        },
        {
          "name": "charging_samples",
          "nullable": true,
          "type": "integer"
        },
        {
          "name": "reserved_samples",
          "nullable": true,
          "type": "integer"
        },
        {
          "name": "occupied_samples",
          "nullable": true,
          "type": "integer"
        },
        {
          "name": "maintenance_samples",
          "nullable": true,
          "type": "integer"
        },
        {
          "name": "offline_samples",
          "nullable": true,
          "type": "integer"
        },
        {
          "name": "sample_count",
          "nullable": true,
          "type": "integer"
        },
        {
          "name": "expected_sample_count",
          "nullable": true,
          "type": "integer"
        },
        {
          "name": "missing_sample_count",
          "nullable": true,
          "type": "integer"
        },
        {
          "name": "observed_hours",
          "nullable": true,
          "type": "integer"
        },
        {
          "name": "complete_hours",
          "nullable": true,
          "type": "integer"
        },
        {
          "name": "incomplete_hours",
          "nullable": true,
          "type": "integer"
        },
        {
          "name": "complete_charging_samples",
          "nullable": true,
          "type": "integer"
        },
        {
          "name": "complete_sample_count",
          "nullable": true,
          "type": "integer"
        },
        {
          "name": "charging_utilization",
          "nullable": true,
          "type": "number",
          "unit": "ratio_0_1"
        },
        {
          "name": "is_complete",
          "nullable": true,
          "type": "boolean"
        }
      ],
      "files": [
        {
          "bytes": 1965,
          "path": "csv/city_daily/part-00000-2db4498f-8785-4af0-b78f-82c889d35583-c000.csv.gz",
          "sha256": "239bc514095249972fbdfa530765973840125ce562107eddf7300380a8da0313"
        }
      ],
      "primaryKey": [
        "city_id",
        "business_date"
      ],
      "rows": 35
    },
    "ml_features_hourly": {
      "columns": [
        {
          "name": "station_id",
          "nullable": false,
          "type": "string"
        },
        {
          "name": "city_id",
          "nullable": true,
          "type": "string"
        },
        {
          "name": "reference_time",
          "nullable": false,
          "type": "timestamp"
        },
        {
          "name": "business_date",
          "nullable": true,
          "type": "date"
        },
        {
          "name": "feature_version",
          "nullable": false,
          "type": "string"
        },
        {
          "name": "history_start_at",
          "nullable": true,
          "type": "timestamp"
        },
        {
          "name": "history_end_at",
          "nullable": true,
          "type": "timestamp"
        },
        {
          "name": "history_complete",
          "nullable": true,
          "type": "boolean"
        },
        {
          "name": "hour_of_day",
          "nullable": true,
          "type": "integer"
        },
        {
          "name": "day_of_week",
          "nullable": true,
          "type": "integer"
        },
        {
          "name": "is_weekend",
          "nullable": true,
          "type": "boolean"
        },
        {
          "name": "is_public_holiday",
          "nullable": false,
          "type": "boolean"
        },
        {
          "name": "is_adjusted_workday",
          "nullable": false,
          "type": "boolean"
        },
        {
          "name": "capacity",
          "nullable": false,
          "type": "integer"
        },
        {
          "name": "rated_capacity_kw",
          "nullable": true,
          "type": "number",
          "unit": "kW"
        },
        {
          "name": "last_available_count",
          "nullable": true,
          "type": "integer"
        },
        {
          "name": "lag_power_kw_h01",
          "nullable": true,
          "type": "number",
          "unit": "kW"
        },
        {
          "name": "lag_power_kw_h02",
          "nullable": true,
          "type": "number",
          "unit": "kW"
        },
        {
          "name": "lag_power_kw_h03",
          "nullable": true,
          "type": "number",
          "unit": "kW"
        },
        {
          "name": "lag_power_kw_h04",
          "nullable": true,
          "type": "number",
          "unit": "kW"
        },
        {
          "name": "lag_power_kw_h05",
          "nullable": true,
          "type": "number",
          "unit": "kW"
        },
        {
          "name": "lag_power_kw_h06",
          "nullable": true,
          "type": "number",
          "unit": "kW"
        },
        {
          "name": "lag_power_kw_h07",
          "nullable": true,
          "type": "number",
          "unit": "kW"
        },
        {
          "name": "lag_power_kw_h08",
          "nullable": true,
          "type": "number",
          "unit": "kW"
        },
        {
          "name": "lag_power_kw_h09",
          "nullable": true,
          "type": "number",
          "unit": "kW"
        },
        {
          "name": "lag_power_kw_h10",
          "nullable": true,
          "type": "number",
          "unit": "kW"
        },
        {